{
  "id": 1,
  "id_str": "1",
  "name": "my_new_list",
  "applications": [
    {
      "application_id": 1,
      "application_id_str": "1",
      "access": "restricted",
      "attached_rules": {
        "skip": 1,
        "overriding_accept": 0,
        "refuse": 0,
        "review": 2,
        "accept": 3,
        "trust": 1
      }
    }
  ],
  "display_name": "My new list",
  "active_items_count": 0,
  "expired_items_count": 0,
  "fields": [
    {
      "name": "User IP Address",
      "type": "IP_ADDRESS"
    }
  ]
}
